{
  "id": "OBJ-20260712-agentic-work-best-practices",
  "title": "Production-grade source of truth for Codex and Claude agentic work",
  "source": {
    "artifact": "Objectives/active/OBJ-20260712-agentic-work-best-practices-source.md",
    "captured_at": "2026-07-12T18:00:00+02:00"
  },
  "status": "active",
  "pillars": [
    {
      "id": "P01",
      "title": "Seamless universal adoption",
      "requirements": [
        {
          "id": "REQ-BOOT-001",
          "statement": "A fresh Codex or Claude session in any repository discovers the stable source of truth without repeated human guidance.",
          "status": "partial",
          "acceptance": ["Global bootstrap exists for both platforms", "A fresh-session probe proves which files loaded", "The bootstrap points only to a promoted stable release"],
          "evidence": ["Global pointer files exist, but currently point at an unversioned working tree"],
          "notes": "Must be completed by init/doctor and stable promotion semantics."
        },
        {
          "id": "REQ-BOOT-002",
          "statement": "An idempotent init command installs or merges pointers without destroying repository-specific instructions.",
          "status": "verified",
          "acceptance": ["Second run makes no diff", "Existing CLAUDE.md and AGENTS.md content is preserved", "Windows and WSL paths are supported"],
          "evidence": ["Evals/test-windows-platform.ps1: spaces, UTF-8, CRLF and second-run hash idempotency", "tools/init.ps1: managed-block merge preserves existing repository guidance"]
        },
        {
          "id": "REQ-BOOT-003",
          "statement": "A doctor command diagnoses discovery, versions, dependencies, trust, permissions, hooks, path and OneDrive issues.",
          "status": "verified",
          "acceptance": ["Returns non-zero on a broken setup", "Never prints secrets", "Produces actionable remediation"],
          "evidence": [
            "tools/doctor.ps1 emits structured PASS/WARN/FAIL checks and exits 2 when a required file, manifest or target repository is broken.",
            "Doctor output reports paths, versions and specific remediation context without reading or printing authentication payloads or secret values.",
            "Evals/test-windows-platform.ps1 and tools/preflight.ps1 exercise doctor behavior under the supported Windows/OneDrive startup path."
          ]
        }
      ]
    },
    {
      "id": "P02",
      "title": "Minimal context and Agentic Knowledge Router",
      "requirements": [
        {
          "id": "REQ-ROUTE-001",
          "statement": "Every task receives a deterministic task fingerprint using task type, lifecycle, artifacts, paths, domain and risk.",
          "status": "verified",
          "acceptance": ["Fingerprint is machine-readable", "Routing is reproducible", "Unknown and low-confidence states are explicit"],
          "evidence": ["tools/route.ps1: machine-readable fingerprint, explicit risk and confidence", "Evals/run-evals.ps1: deterministic 12-case routing suite"]
        },
        {
          "id": "REQ-ROUTE-002",
          "statement": "Only the minimal Core and relevant knowledge modules are loaded rather than the full knowledge base.",
          "status": "verified",
          "acceptance": ["Context pack lists selected and rejected modules", "A context budget is enforced", "Module selection has an explanation"],
          "evidence": ["Router/catalog/modules.json: maximum module budget", "tools/route.ps1: selected/rejected modules with reasons", "Evals/tools/new-run.ps1: only routed files copied into benchmark context"]
        },
        {
          "id": "REQ-ROUTE-003",
          "statement": "Security-critical modules favor recall while routine modules favor precision and unnecessary context is measured.",
          "status": "in_progress",
          "acceptance": ["Security required-module miss rate is zero in the routing suite", "False-positive module rate is reported"],
          "evidence": [
            "Evals/run-evals.ps1 passes all 12 required-module routing cases.",
            "Evals/test-runtime-controls.ps1 includes a regression proving that plural credentials, secrets and tokens route to the high-risk security module.",
            "Aggregate false-positive context cost is not yet reported, so the requirement remains in progress."
          ]
        }
      ]
    },
    {
      "id": "P03",
      "title": "Correctness, generalization and change impact",
      "requirements": [
        {
          "id": "REQ-GEN-001",
          "statement": "Agents distinguish closed-world constants from open-world discovery and never treat an observed sample as the production universe.",
          "status": "partial",
          "acceptance": ["Decision is recorded", "Open-world paths handle unknown values", "Constants cite an authoritative source"],
          "evidence": ["The current doctrine warns against hardcoding but has no mechanical gate"]
        },
        {
          "id": "REQ-GEN-002",
          "statement": "Parser, extraction, classification, mapping and regex work is tested on unseen, negative, malformed and adversarial inputs.",
          "status": "pending",
          "acceptance": ["Hidden unseen-entity case passes", "Property or metamorphic assertions exist where applicable", "Regex performance and ReDoS risk are checked"],
          "evidence": []
        },
        {
          "id": "REQ-IMPACT-001",
          "statement": "Changes to functions, schemas, APIs and contracts trigger repository-wide downstream impact analysis.",
          "status": "partial",
          "acceptance": ["Definitions and call sites are enumerated", "Affected consumers and contracts are recorded", "Repo-wide build or equivalent check runs"],
          "evidence": ["Current contracts mention symbol search but do not record machine-checkable evidence"]
        },
        {
          "id": "REQ-CORR-001",
          "statement": "Undefined variables, invalid imports, invented APIs and integration bugs are caught before completion.",
          "status": "partial",
          "acceptance": ["Typecheck or compile step is selected when available", "Runtime smoke test exercises the changed surface", "Invented APIs are verified against source or installed version"],
          "evidence": ["Current Definition of Done is advisory only"]
        }
      ]
    },
    {
      "id": "P04",
      "title": "Objective integrity and work continuity",
      "requirements": [
        {
          "id": "REQ-OBJ-001",
          "statement": "Every user requirement is preserved with a stable ID and traced to plan, implementation, verification and evidence.",
          "status": "in_progress",
          "acceptance": ["Original request is immutable", "No requirement disappears during normalization", "Coverage checker rejects evidence-free completion"],
          "evidence": ["This objective ledger created"]
        },
        {
          "id": "REQ-OBJ-002",
          "statement": "An objective cannot be marked complete while any requirement is pending, partial, in progress or blocked without an explicit accepted exception.",
          "status": "verified",
          "acceptance": ["objective-check exits non-zero", "N/A and rejected entries require a reason", "Coverage summary is generated"],
          "evidence": ["tools/objective-check.ps1 rejects incomplete objectives with non-zero exit", "Final local audit on 2026-07-12 confirmed rejection while requirements remain open"]
        },
        {
          "id": "REQ-SESSION-001",
          "statement": "Long-running work survives context reset through concise structured state, evidence and an unambiguous next action.",
          "status": "partial",
          "acceptance": ["Fresh-session resume mock succeeds", "Raw transcripts are not the primary memory", "Workstream updates are proportional to task risk"],
          "evidence": ["Current workstream convention exists but is prose-heavy and unconditional"]
        },
        {
          "id": "REQ-LOOP-001",
          "statement": "Every agentic loop has a verifiable end state, progress signal, budget, kill switch, escalation rule and safe checkpoint.",
          "status": "partial",
          "acceptance": ["Loop manifest is machine-readable", "No-progress and repeated-failure stops are tested", "Irreversible actions remain human-gated"],
          "evidence": ["Platform contracts describe bounded loops but no shared controller exists"]
        }
      ]
    },
    {
      "id": "P05",
      "title": "Evaluation and measurable improvement",
      "requirements": [
        {
          "id": "REQ-EVAL-001",
          "statement": "Vanilla, minimal-Core, Router and Router-plus-enforcement environments are compared under controlled conditions.",
          "status": "in_progress",
          "acceptance": ["Same model, prompt, budget and clean fixture are used", "Multiple trials are supported", "Results include cost, time and final-state correctness"],
          "evidence": [
            "Evals/tools/new-benchmark-campaign.ps1 fixes a randomized 2-fixture x 2-provider x 2-arm x 5-trial design and stages spend at 4, 8, 24 and 40 cumulative runs.",
            "Evals/tools/run-benchmark-stage.ps1 enforces per-stage approval, run/time/turn ceilings, failure/no-progress stops and Evals/local/STOP before provider execution.",
            "Evals/reports/20260713-135148-subscription-campaign-smoke.json records a clean four-call Codex/Claude smoke with zero overlaps or invalid attempts; its one-trial ceiling is explicitly non-comparative.",
            "Evals/reports/20260713-151556-calibration-probe-calibration.json records an explicitly model-pinned two-call Codex calibration that stopped at a shared 100 ceiling.",